{
  "agentId": "agentic-ai-systems-subject-lead-reference-chapter",
  "subject": "Agentic AI Systems",
  "task": "Create the first production-quality narrative reference chapter and portable subject-book skeleton",
  "status": "completed",
  "filesCreated": [
    "content/subjects/agentic-ai-systems/index.mdx",
    "content/subjects/agentic-ai-systems/book/00-preface.md",
    "content/subjects/agentic-ai-systems/book/01-how-to-use-this-book.md",
    "content/subjects/agentic-ai-systems/book/02-prerequisites.md",
    "content/subjects/agentic-ai-systems/book/03-learning-outcomes.md",
    "content/subjects/agentic-ai-systems/book/04-subject-roadmap.md",
    "content/subjects/agentic-ai-systems/book/05-mathematical-notation.md",
    "content/subjects/agentic-ai-systems/chapters/01-a-useful-agent-knows-when-to-stop.mdx",
    "content/subjects/agentic-ai-systems/references.md",
    "content/subjects/agentic-ai-systems/references.bib",
    "content/subjects/agentic-ai-systems/glossary.md",
    "content/subjects/agentic-ai-systems/further-reading.md",
    "content/subjects/agentic-ai-systems/further-reading.md",
    "content/subjects/agentic-ai-systems/research-papers/README.md",
    "content/subjects/agentic-ai-systems/projects/README.md",
    "content/subjects/agentic-ai-systems/assignments/README.md",
    "content/subjects/agentic-ai-systems/quizzes/README.md",
    "content/subjects/agentic-ai-systems/datasets/README.md",
    "tasks/agent-work/elective/agentic-ai-systems/reference-chapter/completion-report.json"
  ],
  "filesModified": [],
  "sourcesUsed": [
    "BITS Pilani WILP M.Tech. AI & ML brochure, physical PDF page 16 and printed page 14; verified course-topic description",
    "Yao et al. 2023, ReAct, arXiv:2210.03629, DOI 10.48550/arXiv.2210.03629",
    "Schick et al. 2023, Toolformer, arXiv:2302.04761, DOI 10.48550/arXiv.2302.04761",
    "Shinn et al. 2023, Reflexion, arXiv:2303.11366, DOI 10.48550/arXiv.2303.11366",
    "Lewis et al. 2020, Retrieval-Augmented Generation, arXiv:2005.11401",
    "NIST AI Risk Management Framework 1.0 and Generative AI Profile",
    "OpenAI official function-calling and structured-output documentation",
    "Shivam2003 Speech and Language Processing Chapter 1, consulted only for compact narrative architecture"
  ],
  "citationsVerified": 8,
  "citationsRejected": 0,
  "wordCount": 3332,
  "testsRun": [
    "meaningful prose count with scripts/calculate-word-count/chapter-word-count.mjs",
    "source heading audit for ten compact H2 sections",
    "Python syntax and execution of the published safety-loop block",
    "MDX/static export and rendered tests (3/3 passed)",
    "internal static-link validation (653 links passed)",
    "foundation validation (45 subjects and 45 leads passed)",
    "ESLint, TypeScript noEmit, production npm audit, and git diff --check passed"
  ],
  "validationResults": {
    "officialCurriculumBoundary": "passed: brochure topic description is named; elective semester remains configurable",
    "chapterStructure": "passed: ten compact narrative H2 sections; no checklist-style 29-item TOC",
    "meaningfulProseWords": 3332,
    "minimumMeaningfulProseWords": 3000,
    "projectContracts": "passed: six contracts include objectives, prerequisites, data/licence, milestones, metrics, tests, deployment, ethics, and rubrics",
    "mathjax": "present: state-transition, objective, stopping, and context equations",
    "codeStatus": "pending independent review; deterministic allow-listed tool loop executed with safety assertions",
    "citationStatus": "pending independent claim-level and URL review",
    "mathReview": "pending independent review of objective, stopping predicate, and context-selection notation",
    "editorialStatus": "pending independent review",
    "renderedAccessibility": "pending application-level rendering and responsive WCAG review",
    "fullChaptersCreated": 1,
    "sharedFilesTouched": false
  },
  "openIssues": [
    "Independent mathematics, citation, originality, editorial, accessibility, and rendered-layout reviews are required before publication.",
    "The chapter's model adapter is deliberately a deterministic stand-in; production provider integration belongs in a later chapter.",
    "Later chapters, paper detail pages, and full subject project implementations remain planned."
  ],
  "recommendedNextTasks": [
    "Run the repository static build and rendered chapter checks with the Agentic AI route.",
    "Run independent claim/citation, math, code, and editorial reviews against the immutable chapter hash.",
    "Integrate only after all review states are explicitly approved."
  ]
}
