{
  "agentId": "SUBJ-011-CH01",
  "subject": "Automated Reasoning",
  "task": "Create the first production-quality narrative reference chapter and book shell",
  "status": "completed",
  "filesCreated": [
    "content/subjects/automated-reasoning/index.mdx",
    "content/subjects/automated-reasoning/book/00-preface.md",
    "content/subjects/automated-reasoning/book/01-how-to-use-this-book.md",
    "content/subjects/automated-reasoning/book/02-prerequisites.md",
    "content/subjects/automated-reasoning/book/03-learning-outcomes.md",
    "content/subjects/automated-reasoning/book/04-subject-roadmap.md",
    "content/subjects/automated-reasoning/book/05-mathematical-notation.md",
    "content/subjects/automated-reasoning/chapters/01-a-solver-must-explain-its-answer.mdx",
    "content/subjects/automated-reasoning/references.md",
    "content/subjects/automated-reasoning/references.bib",
    "content/subjects/automated-reasoning/further-reading.md",
    "content/subjects/automated-reasoning/glossary.md",
    "content/subjects/automated-reasoning/research-papers/README.md",
    "content/subjects/automated-reasoning/papers/README.md",
    "content/subjects/automated-reasoning/projects/README.md",
    "content/subjects/automated-reasoning/assignments/README.md",
    "content/subjects/automated-reasoning/quizzes/README.md",
    "content/subjects/automated-reasoning/datasets/README.md"
  ],
  "filesModified": [
    "content/subjects/automated-reasoning/chapters/01-a-solver-must-explain-its-answer.mdx",
    "content/subjects/automated-reasoning/references.md",
    "content/subjects/automated-reasoning/references.bib",
    "tasks/agent-work/electives/automated-reasoning/reference-chapter/publication-review.md",
    "tasks/agent-work/electives/automated-reasoning/reference-chapter/publication-review.json"
  ],
  "sourcesUsed": [
    "BITS Pilani WILP M.Tech. AI & ML_New Brochure_2026 copy (2026), physical PDF page 12 / printed page 10, SHA-256 fee3ec5d142deb610e1f0a86df9267e3c9355f1dfdda4419d21f49b45207de1b",
    "Robinson, A Machine-Oriented Logic Based on the Resolution Principle (JACM, 1965), DOI 10.1145/321250.321253",
    "Moskewicz et al., Chaff: Engineering an Efficient SAT Solver (DAC, 2001), DOI 10.1145/378239.379017",
    "de Moura and Bjørner, Z3: An Efficient SMT Solver (TACAS, 2008), DOI 10.1007/978-3-540-78800-3_24",
    "Blanchette et al., A Verified SAT Solver Framework with Learn, Forget, Restart, and Incrementality (JAR, 2018), DOI 10.1007/s10817-018-9455-7",
    "SAT Competition benchmark archive and SMT-LIB official benchmark specifications"
  ],
  "citationsVerified": 5,
  "citationsRejected": 0,
  "wordCount": 3177,
  "testsRun": [
    "Recomputed meaningful prose count with scripts/calculate-word-count/chapter-word-count.mjs: 3177",
    "Extracted and executed the first Python DPLL block with deterministic SAT/UNSAT assertions",
    "Validated chapter metadata and compact narrative H2 structure",
    "Validated all project contracts contain problem, prerequisites, architecture, dataset/licence, milestones, metrics, deliverables/tests, extension/deployment/ethics, and rubric fields",
    "npm run validate:foundation: passed (45 subjects, 39 electives, 45 leads)",
    "GITHUB_REPOSITORY=shivam2003-dev/mtech-ai-ml-learning-hub npm run validate:links: passed (76 HTML files, 623 internal links)",
    "npm run build:pages: passed (78 static routes)",
    "node --test tests/rendered-html.test.mjs: passed (3 tests)",
    "npm run lint: passed",
    "npx tsc --noEmit --incremental false: passed",
    "npm audit --omit=dev --audit-level=high: passed (0 production vulnerabilities)",
    "git diff --check: passed"
  ],
  "validationResults": {
    "officialCurriculum": "passed: exact elective title and configurable Semester 2–3 placement verified; detailed units unavailable",
    "scope": "passed: proposed topics are explicitly labelled prerequisite, supplementary, advanced extension, or industry application",
    "chapterWordMinimum": "passed: 3177 meaningful prose words, excluding code and references",
    "chapterStructure": "passed: compact nine reader-facing H2 sections with narrative flow",
    "math": "passed independent publication review; resolution soundness, DPLL invariant, and complexity claims checked",
    "code": "passed independent publication review; exact Python and Z3 blocks executed",
    "citations": "passed independent publication review; five DOI identities verified and bibliography corrected",
    "editorial": "passed independent publication review",
    "renderedPublication": "passed independent publication review; static render and responsive controls checked",
    "bookShell": "passed: preface, usage, prerequisites, outcomes, roadmap, notation, references, projects, assignments, quizzes, datasets, glossary, and paper folders present"
  },
  "openIssues": [
    "Independent review covers this Chapter 1 snapshot only; future chapter changes require a new review.",
    "The brochure contains no topic-level units, prerequisites, learning outcomes, assessment weights, or official reading list for this subject.",
    "The next seven chapter routes are planned but not yet published, so next-reading destinations are intentionally not linked."
  ],
  "recommendedNextTasks": [
    "Cherry-pick this reviewed chapter and its publication-review report into develop.",
    "Create Chapter 2 only after its outline and source gate pass.",
    "Re-run this review if the Chapter 1 content or bibliography hash changes."
  ]
}
