{
  "agentId": "subject-lead-elective-ai-ml-cyber-security",
  "subject": "AI and ML Techniques for Cyber Security",
  "task": "Create the first full-content vertical slice and subject-book skeleton",
  "status": "completed",
  "filesCreated": [
    "content/subjects/ai-and-ml-techniques-for-cyber-security/index.mdx",
    "content/subjects/ai-and-ml-techniques-for-cyber-security/book/00-preface.md",
    "content/subjects/ai-and-ml-techniques-for-cyber-security/book/01-how-to-use-this-book.md",
    "content/subjects/ai-and-ml-techniques-for-cyber-security/book/02-prerequisites.md",
    "content/subjects/ai-and-ml-techniques-for-cyber-security/book/03-learning-outcomes.md",
    "content/subjects/ai-and-ml-techniques-for-cyber-security/book/04-subject-roadmap.md",
    "content/subjects/ai-and-ml-techniques-for-cyber-security/book/05-mathematical-notation.md",
    "content/subjects/ai-and-ml-techniques-for-cyber-security/book/06-research-reading.md",
    "content/subjects/ai-and-ml-techniques-for-cyber-security/book/07-assessment.md",
    "content/subjects/ai-and-ml-techniques-for-cyber-security/chapters/01-from-security-question-to-ml-evidence-contract.mdx",
    "content/subjects/ai-and-ml-techniques-for-cyber-security/references.md",
    "content/subjects/ai-and-ml-techniques-for-cyber-security/references.bib",
    "content/subjects/ai-and-ml-techniques-for-cyber-security/glossary.md",
    "content/subjects/ai-and-ml-techniques-for-cyber-security/further-reading.md",
    "content/subjects/ai-and-ml-techniques-for-cyber-security/projects/README.md",
    "content/subjects/ai-and-ml-techniques-for-cyber-security/assignments/README.md",
    "content/subjects/ai-and-ml-techniques-for-cyber-security/quizzes/README.md",
    "content/subjects/ai-and-ml-techniques-for-cyber-security/datasets/README.md",
    "content/subjects/ai-and-ml-techniques-for-cyber-security/papers/README.md",
    "content/subjects/ai-and-ml-techniques-for-cyber-security/research-papers/README.md",
    "tasks/agent-work/electives/ai-and-ml-techniques-for-cyber-security/reference-chapter/word-count-validation.json",
    "tasks/agent-work/electives/ai-and-ml-techniques-for-cyber-security/reference-chapter/code-validation.md",
    "tasks/agent-work/electives/ai-and-ml-techniques-for-cyber-security/reference-chapter/code-validation.json",
    "tasks/agent-work/electives/ai-and-ml-techniques-for-cyber-security/reference-chapter/source-validation.json",
    "tasks/agent-work/electives/ai-and-ml-techniques-for-cyber-security/reference-chapter/completion-report.json"
  ],
  "filesModified": [],
  "sourcesUsed": [
    "BITS Pilani WILP M.Tech AI and ML brochure, SHA-256 fee3ec5d142deb610e1f0a86df9267e3c9355f1dfdda4419d21f49b45207de1b",
    "NIST Cybersecurity Framework 2.0, official NIST page",
    "NIST AI Risk Management Framework 1.0, DOI 10.6028/NIST.AI.100-1",
    "MITRE ATT&CK Enterprise techniques, official knowledge base",
    "MITRE ATLAS, official project repository",
    "Anderson and Roth 2018 EMBER, DOI 10.48550/arXiv.1804.04637",
    "Du et al. 2017 DeepLog, DOI 10.1145/3133956.3134015",
    "Choi et al. 2020 cybersecurity survey, DOI 10.1186/s42400-020-00055-5",
    "Macas et al. 2022 cybersecurity survey, DOI 10.1016/j.comnet.2022.109032"
  ],
  "citationsVerified": 9,
  "citationsRejected": 0,
  "wordCount": 3255,
  "testsRun": [
    "node scripts/calculate-word-count/chapter-word-count.mjs: 3255 meaningful prose words",
    "exact extraction and execution of published Python block: assertions passed",
    "npm test: 3 of 3 rendered/static tests passed",
    "npm run validate:foundation: passed",
    "GITHUB_REPOSITORY=shivam2003-dev/mtech-ai-ml-learning-hub npm run validate:links: passed, 593 internal links",
    "npm run lint: passed",
    "npx tsc --noEmit --incremental false: passed",
    "npm audit --omit=dev --audit-level=high: 0 vulnerabilities",
    "git diff --check: passed",
    "rendered chapter: 1 H1, 10 H2, MathJax and code-copy output present"
  ],
  "validationResults": {
    "officialTopicBoundary": "passed-exact",
    "compactNarrativeArchitecture": "passed-10-H2",
    "meaningfulWordCount": "passed-3255",
    "codeExecution": "passed",
    "frontmatterAndMdxBuild": "passed",
    "staticRoutes": "passed-75-routes",
    "renderedChapter": "passed-1-H1-10-H2-MathJax-and-Shiki-code",
    "internalStaticLinkValidator": "passed-593-links",
    "resourceMetadata": "passed",
    "citationMetadata": "passed",
    "independentMathReview": "pending",
    "independentEditorialReview": "pending",
    "independentAccessibilityReview": "pending"
  },
  "openIssues": [
    "Independent mathematics, citation/editorial, rendered accessibility, and final publication reviews remain required before approved or published status.",
    "Only Chapter 1 is authored; the remaining eleven official-topic chapters remain planned."
  ],
  "recommendedNextTasks": [
    "Run independent mathematics and citation/editorial reviews on the immutable chapter commit.",
    "Inspect the rendered subject and chapter at desktop and mobile widths.",
    "Author Chapter 2 only after Chapter 1 review findings are dispositioned."
  ]
}
