{
  "agentId": "subject-lead-012-architecting-ai-systems-reference",
  "subject": "Architecting AI Systems",
  "task": "Create the first production-quality narrative reference chapter and portable subject-book shell",
  "status": "partial",
  "filesCreated": [
    "content/subjects/architecting-ai-systems/index.mdx",
    "content/subjects/architecting-ai-systems/chapters/01-from-a-model-to-a-governed-ai-product.mdx",
    "content/subjects/architecting-ai-systems/book/00-preface.md",
    "content/subjects/architecting-ai-systems/book/01-how-to-use-this-book.md",
    "content/subjects/architecting-ai-systems/book/02-prerequisites.md",
    "content/subjects/architecting-ai-systems/book/03-learning-outcomes.md",
    "content/subjects/architecting-ai-systems/book/04-subject-roadmap.md",
    "content/subjects/architecting-ai-systems/book/05-mathematical-notation.md",
    "content/subjects/architecting-ai-systems/book/06-research-reading.md",
    "content/subjects/architecting-ai-systems/book/07-assessment.md",
    "content/subjects/architecting-ai-systems/projects/README.md",
    "content/subjects/architecting-ai-systems/assignments/README.md",
    "content/subjects/architecting-ai-systems/quizzes/README.md",
    "content/subjects/architecting-ai-systems/datasets/README.md",
    "content/subjects/architecting-ai-systems/references.md",
    "content/subjects/architecting-ai-systems/references.bib",
    "content/subjects/architecting-ai-systems/glossary.md",
    "content/subjects/architecting-ai-systems/further-reading.md",
    "content/subjects/architecting-ai-systems/papers/README.md",
    "content/subjects/architecting-ai-systems/research-papers/README.md",
    "tasks/agent-work/elective/architecting-ai-systems/reference-chapter/completion-report.json"
  ],
  "filesModified": [],
  "sourcesUsed": [
    "BITS Pilani WILP M.Tech. Artificial Intelligence and Machine Learning brochure, physical PDF page 17 and printed page 15, SHA-256 fee3ec5d142deb610e1f0a86df9267e3c9355f1dfdda4419d21f49b45207de1b",
    "Sculley et al. 2015, Hidden Technical Debt in Machine Learning Systems, DOI 10.1145/2783258.2783307",
    "Amershi et al. 2019, Software Engineering for Machine Learning, DOI 10.1145/3287560.3287596",
    "Burns et al. 2016, Borg, Omega, and Kubernetes, DOI 10.1145/2898442.2898444",
    "Dean and Barroso 2013, The Tail at Scale, DOI 10.1145/2408776.2408794",
    "NIST 2018, Application Container Security Guide, DOI 10.6028/NIST.SP.800-190",
    "NIST 2023, AI Risk Management Framework 1.0, DOI 10.6028/NIST.AI.100-1",
    "OpenAPI Initiative 2024, OpenAPI Specification 3.1.1, https://spec.openapis.org/oas/",
    "Google SRE book, https://sre.google/sre-book/table-of-contents/",
    "OpenTelemetry documentation, https://opentelemetry.io/docs/",
    "Model Context Protocol specification, https://modelcontextprotocol.io/specification",
    "Agent2Agent protocol documentation, https://a2a-protocol.org/latest/"
  ],
  "citationsVerified": 12,
  "citationsRejected": 0,
  "wordCount": 3340,
  "testsRun": [
    "meaningful prose count with scripts/calculate-word-count/chapter-word-count.mjs",
    "compact narrative heading audit: ten H2 sections and no authored body H1",
    "frontmatter inspection for subject and chapter metadata",
    "exact execution of the published Python validator sample and negative fixtures",
    "MDX production build with MathJax and Shiki",
    "foundation registry validation for 45 subjects and 45 Subject Leads",
    "internal static-link validation with the GitHub Pages repository base path",
    "ESLint, TypeScript, production dependency audit, and git diff --check"
  ],
  "validationResults": {
    "officialCurriculumBoundary": "passed: brochure topic list is the source of truth; chapter order and tools are labelled synthesis, supplementary, or advanced extension",
    "topicCoverage": "passed: end-to-end design, components, architectural styles, agentic architecture, ADLC, MCP/A2A, system principles, scalability, performance, resiliency, blueprints, infrastructure, production, and governance are addressed",
    "meaningfulProseWords": 3340,
    "minimumMeaningfulProseWords": 3000,
    "chapterFrontmatterWordCountMatches": true,
    "chapterStructure": "passed: ten compact H2 sections follow problem, map, contracts/styles, ADLC, agent boundaries, performance, resiliency, infrastructure, governance/lab, and oral summary/references",
    "chapterBodyH1Count": 0,
    "subjectBookShell": "passed: preface, use guide, prerequisites, outcomes, roadmap, notation, research reading, assessment, projects, assignments, quizzes, datasets, references, glossary, further reading, and paper paths",
    "pythonValidator": "passed: valid manifest returns []; malformed type, missing component, duplicate name, non-positive timeout, unknown dependency, missing percentile, fallback, and approval-rule cases return deterministic errors",
    "mathjax": "passed: equations use LaTeX-compatible delimiters and compile through the repository MathJax pipeline",
    "citationStatus": "pending independent claim-level citation review",
    "mathReview": "pending independent review of queueing and availability approximations",
    "editorialStatus": "pending independent academic editorial and rendered UX review",
    "fullChaptersCreated": 1,
    "sharedFilesTouched": false
  },
  "openIssues": [
    "Independent mathematics, citation, originality, editorial, accessibility, and rendered-layout reviews are required before publication approval.",
    "The configurable Semester 2–3 elective mapping remains unresolved by the brochure.",
    "Protocol links and current specifications must be re-verified immediately before a production implementation.",
    "Later chapters and full paper notes remain planned; this is the first vertical slice, not the complete subject book."
  ],
  "recommendedNextTasks": [
    "Run independent mathematics and systems review on queueing, availability, and capacity equations.",
    "Run citation and originality review against the immutable chapter snapshot.",
    "Render the subject and chapter routes and inspect MathJax, code, anchors, mobile layout, print mode, and accessible names.",
    "Use this approved-format candidate to authorize Chapters 2 through 10 only after their source and quality gates pass."
  ]
}
