{
  "agentId": "subject-lead-sem1-introduction-to-statistical-methods",
  "subject": "Introduction to Statistical Methods",
  "task": "Create a source-transparent Semester 1 subject plan without inventing an official syllabus",
  "status": "completed",
  "filesCreated": [
    "tasks/agent-work/semester-1/statistical-methods/plan.md",
    "tasks/agent-work/semester-1/statistical-methods/completion-report.json"
  ],
  "filesModified": [],
  "sourcesUsed": [
    "/Users/shivamkumar/Downloads/mtech-ai-ml.pdf#physical-page=12&printed-page=10",
    "tasks/agent-work/semester-1/statistical-methods/plan.md#verified-authoritative-resources-STAT-R01-STAT-R26",
    "tasks/agent-work/semester-1/statistical-methods/plan.md#preliminary-dataset-registry-DS-STAT-001-DS-STAT-003"
  ],
  "citationsVerified": 29,
  "citationsRejected": 0,
  "wordCount": 4590,
  "testsRun": [
    "official-syllabus boundary review",
    "26-resource metadata and URL review",
    "21 resource DOI metadata lookups through Crossref",
    "probability scope ownership and cross-link review",
    "chapter-count and additive hour validation",
    "project-tier validation",
    "three-dataset official identity, DOI, and licence verification",
    "resource source-ID traceability validation",
    "JSON syntax validation",
    "scope and file-isolation check"
  ],
  "validationResults": {
    "officialTitleVerified": true,
    "officialTopicLevelSyllabusAvailable": false,
    "proposedTopicsClearlyLabeled": true,
    "chapterCount": 11,
    "chapterCountWithinRequiredRange": true,
    "probabilityFoundationsOwnedByMathematicalFoundations": true,
    "probabilityTreatment": "brief-diagnostic-and-cross-link",
    "statisticalMethodsOwnership": [
      "sampling and study design",
      "sampling distributions",
      "estimation and likelihood",
      "interval estimation and resampling",
      "hypothesis testing and power",
      "categorical, nonparametric, and multiple inference",
      "linear models and ANOVA",
      "Bayesian statistical modelling and diagnostics",
      "robustness and missing-data sensitivity",
      "production experimentation and governance"
    ],
    "learningOutcomesIncluded": true,
    "prerequisiteMapIncluded": true,
    "knowledgeGraphIncluded": true,
    "researchQueries": 16,
    "verifiedAuthoritativeResources": 26,
    "resourceCountWithinRequiredRange": true,
    "verifiedNamedDatasets": 3,
    "datasetLicencesRecorded": true,
    "resourceIdsTraceable": true,
    "paperReadingPathIncluded": true,
    "projects": {
      "beginner": 2,
      "intermediate": 2,
      "advanced": 1,
      "research": 1
    },
    "assignmentPlanIncluded": true,
    "quizPlanIncluded": true,
    "estimatedHours": 187,
    "hourModel": {
      "theoryReadingDerivation": 95,
      "guidedPythonLabs": 42,
      "assignmentsAndQuizzes": 30,
      "selectedProjectIncrements": 20,
      "fullRoute": 187,
      "semesterCoreChapters1To8": 122,
      "advancedExtensionChapters9To11": 65,
      "doubleCountingDetected": false
    },
    "fullChaptersWritten": 0
  },
  "openIssues": [
    "Detailed official BITS course handout is not available",
    "Official unit boundaries, assessment weights, and prescribed texts remain unknown",
    "The remediated plan requires independent re-review before full chapter drafting"
  ],
  "recommendedNextTasks": [
    "Obtain and parse the official detailed subject handout",
    "Run the independent re-review acceptance tests",
    "Run citation verifier against all selected chapter-level references and datasets",
    "Approve Chapters 1-8 as the 122-hour semester core before full drafting",
    "Prototype the Chapter 1 subject-page experience without asserting official unit status"
  ]
}
