{
  "agentId": "subject-lead:mathematical-foundations-for-machine-learning",
  "subject": "Mathematical Foundations for Machine Learning",
  "task": "Normalize the subject-planning completion report to the canonical agent-report schema and independently recheck its plan arithmetic",
  "status": "completed",
  "filesCreated": [],
  "filesModified": [
    "tasks/agent-work/semester-1/mathematical-foundations/completion-report.json"
  ],
  "sourcesUsed": [
    "official-brochure | BITS Pilani WILP M.Tech. Artificial Intelligence and Machine Learning brochure | local source SHA-256 fee3ec5d142deb610e1f0a86df9267e3c9355f1dfdda4419d21f49b45207de1b | physical PDF page 12, printed page 10",
    "R01 | Mathematics for Machine Learning | https://mml-book.github.io/ | canonical metadata in plan.md section 8",
    "R02 | Convex Optimization | https://web.stanford.edu/~boyd/cvxbook/ | canonical metadata in plan.md section 8",
    "R03 | Numerical Optimization | https://link.springer.com/book/10.1007/978-0-387-40065-5 | canonical metadata in plan.md section 8",
    "R04 | MIT 18.06SC Linear Algebra | https://ocw.mit.edu/courses/18-06sc-linear-algebra-fall-2011/ | canonical metadata in plan.md section 8",
    "R05 | Harvard Stat 110 Probability | https://stat110.hsites.harvard.edu/ | canonical metadata in plan.md section 8",
    "R06 | Stanford EE364a Convex Optimization I | https://web.stanford.edu/class/ee364a/ | canonical metadata in plan.md section 8",
    "R07 | An Essay towards Solving a Problem in the Doctrine of Chances | https://doi.org/10.1098/rstl.1763.0053 | canonical metadata in plan.md section 8",
    "R08 | On Lines and Planes of Closest Fit to Systems of Points in Space | https://doi.org/10.1080/14786440109462720 | canonical metadata in plan.md section 8",
    "R09 | A Mathematical Theory of Communication | https://doi.org/10.1002/j.1538-7305.1948.tb01338.x | canonical metadata in plan.md section 8",
    "R10 | A Stochastic Approximation Method | https://doi.org/10.1214/aoms/1177729586 | canonical metadata in plan.md section 8",
    "R11 | Learning Representations by Back-Propagating Errors | https://doi.org/10.1038/323533a0 | canonical metadata in plan.md section 8",
    "R12 | Extensions of Lipschitz Mappings into a Hilbert Space | https://doi.org/10.1090/conm/026/737400 | canonical metadata in plan.md section 8",
    "R13 | A Family of Variable-Metric Methods Derived by Variational Means | https://doi.org/10.1090/S0025-5718-1970-0258249-6 | canonical metadata in plan.md section 8",
    "R14 | Natural Gradient Works Efficiently in Learning | https://doi.org/10.1162/089976698300017746 | canonical metadata in plan.md section 8",
    "R15 | Adaptive Subgradient Methods for Online Learning and Stochastic Optimization | https://jmlr.org/papers/v12/duchi11a.html | canonical metadata in plan.md section 8",
    "R16 | Finding Structure with Randomness | https://doi.org/10.1137/090771806 | canonical metadata in plan.md section 8",
    "R17 | Adam: A Method for Stochastic Optimization | https://arxiv.org/abs/1412.6980 | canonical metadata in plan.md section 8",
    "R18 | Optimizing Neural Networks with Kronecker-Factored Approximate Curvature | https://proceedings.mlr.press/v37/martens15.html | canonical metadata in plan.md section 8",
    "R19 | Shampoo: Preconditioned Stochastic Tensor Optimization | https://proceedings.mlr.press/v80/gupta18a.html | canonical metadata in plan.md section 8",
    "R20 | BackPACK: Packing More into Backprop | https://openreview.net/forum?id=BJlrF24twB | canonical metadata in plan.md section 8",
    "R21 | Hutch++: Optimal Stochastic Trace Estimation | https://doi.org/10.1137/1.9781611976496.16 | canonical metadata in plan.md section 8",
    "R22 | Automatic Differentiation in Machine Learning: A Survey | https://www.jmlr.org/papers/v18/17-468.html | canonical metadata in plan.md section 8",
    "R23 | Optimization Methods for Large-Scale Machine Learning | https://doi.org/10.1137/16M1080173 | canonical metadata in plan.md section 8",
    "R24 | Randomized Algorithms for Matrices and Data | https://doi.org/10.1561/2200000035 | canonical metadata in plan.md section 8",
    "R25 | Scikit-learn: Machine Learning in Python | https://www.jmlr.org/papers/v12/pedregosa11a.html | canonical metadata in plan.md section 8",
    "R26 | Array Programming with NumPy | https://doi.org/10.1038/s41586-020-2649-2 | canonical metadata in plan.md section 8"
  ],
  "citationsVerified": 26,
  "citationsRejected": 0,
  "wordCount": 6421,
  "testsRun": [
    "JSON parse check for completion-report.json",
    "AJV draft-2020 validation against packages/content-schema/schemas/agent-report.schema.json",
    "plan SHA-256 calculation",
    "wc -w plan.md: 6421 words",
    "resource-heading audit: 26 records and 26 unique IDs",
    "paper-reading-path audit: 20 entries and 20 unique resource IDs",
    "chapter-table audit: 10 chapters and 96 chapter hours",
    "study-time arithmetic audit: 4 + 96 + 2 + 24 + 16 = 142 hours",
    "research-query audit: 14 provider-specific queries",
    "project-level audit: two beginner, two intermediate, one advanced, and one research-oriented project",
    "project contract audit: all six projects contain learning objectives, prerequisites, extension ideas, and deployment guidance",
    "git diff --check"
  ],
  "validationResults": {
    "schema": {
      "schemaPath": "packages/content-schema/schemas/agent-report.schema.json",
      "draft": "2020-12",
      "status": "passed",
      "additionalProperties": "none",
      "sourcesUsedItemType": "string"
    },
    "sourceTraceability": {
      "officialCurriculumEvidence": "official-brochure string entry includes source identity, page locator, and SHA-256",
      "canonicalAcademicMetadataRegistry": "tasks/agent-work/semester-1/mathematical-foundations/plan.md section 8",
      "requiredMetadataFieldsRecordedInPlan": [
        "title",
        "authorOrOrganisation",
        "publicationYear",
        "resourceType",
        "url",
        "doiOrArxivWhereAvailable",
        "venue",
        "accessedAt",
        "difficulty",
        "relevance",
        "prerequisites",
        "freeOrPaid",
        "confidence",
        "verificationStatus"
      ],
      "resourceIdsUnique": true,
      "academicResourceCount": 26,
      "normalizationNote": "The schema-compatible sourcesUsed strings point to the complete metadata records in plan.md; normalization did not discard source metadata."
    },
    "planEvidence": {
      "path": "tasks/agent-work/semester-1/mathematical-foundations/plan.md",
      "sha256": "64091929d6875120b8b5750ce5e3b3affbd7bbf338e3c2114685e3e19ca91d6c",
      "wordCountMethod": "wc -w",
      "wordCount": 6421
    },
    "arithmetic": {
      "chapterCount": 10,
      "chapterHours": 96,
      "readinessAndFrontMatterHours": 4,
      "probabilityBridgeHours": 2,
      "projectLabHours": 24,
      "assignmentReviewExamHours": 16,
      "estimatedTotalHours": 142,
      "calculation": "4 + 96 + 2 + 24 + 16 = 142"
    },
    "resourceAndPaperCounts": {
      "academicResources": 26,
      "uniqueAcademicResourceIds": 26,
      "paperReadingPath": 20,
      "uniquePaperReadingPathIds": 20,
      "foundational": 4,
      "established": 6,
      "modern": 5,
      "surveyOrTutorial": 3,
      "applied": 2
    },
    "projectCounts": {
      "total": 6,
      "beginner": 2,
      "intermediate": 2,
      "advanced": 1,
      "researchOriented": 1,
      "contractsWithAllFourClaimedFields": 6
    },
    "researchQueries": 14,
    "officialCourseIdentity": "passed",
    "officialTopicBoundary": "passed-no-topic-level-syllabus-claimed",
    "statisticalMethodsOwnership": "passed-principal-probability-distribution-expectation-LLN-CLT-coverage-cross-linked",
    "citationMetadata": "The 26 academic-resource verification records are retained from the source plan; this schema-normalization pass did not perform a new live URL or DOI revalidation.",
    "scopeIsolation": "passed-completion-report-only"
  },
  "openIssues": [
    "The official detailed course handout is unavailable, so every topic-level chapter, outcome, prerequisite, project, and hour estimate remains provisional.",
    "Official assessment format, contact hours, and subject-level tools remain unknown.",
    "Final probability cross-links require coordination with the Introduction to Statistical Methods Subject Lead.",
    "Chapters 9 and 10 may need to become optional advanced extensions after the semester workload review.",
    "Live resource and DOI verification must be repeated at publication time because this normalization pass validated stored evidence and arithmetic, not current external availability."
  ],
  "recommendedNextTasks": [
    "Obtain and verify the registered course handout or LMS unit list.",
    "Run cross-subject review with the Statistical Methods and Machine Learning Subject Leads.",
    "Freeze the shared mathematical notation registry.",
    "Generate and validate BibTeX from the canonical resource metadata in plan.md section 8.",
    "Repeat live link and identifier validation before publication."
  ]
}
