{
  "agentId": "subject-lead-elective-api-driven-cloud-native-solutions",
  "subject": "API-Driven Cloud-Native Solutions",
  "task": "Create the first full-content vertical slice and subject-book skeleton",
  "status": "completed",
  "filesCreated": [
    "content/subjects/api-driven-cloud-native-solutions/index.mdx",
    "content/subjects/api-driven-cloud-native-solutions/book/00-preface.md",
    "content/subjects/api-driven-cloud-native-solutions/book/01-how-to-use-this-book.md",
    "content/subjects/api-driven-cloud-native-solutions/book/02-prerequisites.md",
    "content/subjects/api-driven-cloud-native-solutions/book/03-learning-outcomes.md",
    "content/subjects/api-driven-cloud-native-solutions/book/04-subject-roadmap.md",
    "content/subjects/api-driven-cloud-native-solutions/book/05-mathematical-notation.md",
    "content/subjects/api-driven-cloud-native-solutions/book/06-research-reading.md",
    "content/subjects/api-driven-cloud-native-solutions/book/07-assessment.md",
    "content/subjects/api-driven-cloud-native-solutions/chapters/01-from-an-api-contract-to-a-cloud-native-service.mdx",
    "content/subjects/api-driven-cloud-native-solutions/references.md",
    "content/subjects/api-driven-cloud-native-solutions/references.bib",
    "content/subjects/api-driven-cloud-native-solutions/glossary.md",
    "content/subjects/api-driven-cloud-native-solutions/further-reading.md",
    "content/subjects/api-driven-cloud-native-solutions/projects/README.md",
    "content/subjects/api-driven-cloud-native-solutions/assignments/README.md",
    "content/subjects/api-driven-cloud-native-solutions/quizzes/README.md",
    "content/subjects/api-driven-cloud-native-solutions/datasets/README.md",
    "content/subjects/api-driven-cloud-native-solutions/papers/README.md",
    "content/subjects/api-driven-cloud-native-solutions/research-papers/README.md",
    "tasks/agent-work/electives/api-driven-cloud-native-solutions/reference-chapter/word-count-validation.json",
    "tasks/agent-work/electives/api-driven-cloud-native-solutions/reference-chapter/code-validation.md",
    "tasks/agent-work/electives/api-driven-cloud-native-solutions/reference-chapter/code-validation.json",
    "tasks/agent-work/electives/api-driven-cloud-native-solutions/reference-chapter/source-validation.json",
    "tasks/agent-work/electives/api-driven-cloud-native-solutions/reference-chapter/completion-report.json"
  ],
  "filesModified": [],
  "sourcesUsed": [
    "BITS Pilani WILP M.Tech AI and ML brochure, SHA-256 fee3ec5d142deb610e1f0a86df9267e3c9355f1dfdda4419d21f49b45207de1b",
    "OpenAPI Specification 3.1.1, official OpenAPI Initiative",
    "FastAPI Deployment Concepts, official documentation",
    "RFC 9110 HTTP Semantics, IETF",
    "RFC 9457 Problem Details for HTTP APIs, IETF",
    "Dean and Barroso 2013, The Tail at Scale, DOI 10.1145/2408776.2408794",
    "Sculley et al. 2015, Hidden Technical Debt in Machine Learning Systems, DOI 10.1145/2783258.2783307",
    "Burns et al. 2016, Borg, Omega, and Kubernetes, DOI 10.1145/2898442.2898444",
    "NIST SP 800-190 Application Container Security Guide, DOI 10.6028/NIST.SP.800-190"
  ],
  "citationsVerified": 8,
  "citationsRejected": 0,
  "wordCount": 3209,
  "testsRun": [
    "node scripts/calculate-word-count/chapter-word-count.mjs: 3209 meaningful prose words",
    "MDX frontmatter and compact nine-H2 structure inspection",
    "Python AST syntax compilation of the FastAPI example",
    "npm test: 3 of 3 rendered/static tests passed",
    "npm run validate:foundation: passed (45 subjects, 45 leads)",
    "GITHUB_REPOSITORY=shivam2003-dev/mtech-ai-ml-learning-hub npm run validate:links: passed (623 internal links)",
    "npm run lint: passed",
    "npx tsc --noEmit --incremental false: passed",
    "npm audit --omit=dev --audit-level=high: 0 vulnerabilities",
    "git diff --check: passed",
    "agent report retains exact 14-key completion schema"
  ],
  "validationResults": {
    "officialTopicBoundary": "passed-title-only-explicit-supplementary",
    "compactNarrativeArchitecture": "passed-9-H2",
    "meaningfulWordCount": "passed-3209",
    "codeExecution": "passed-python-ast-pending-independent-fastapi-runtime-review",
    "frontmatterAndMdxBuild": "passed-78-static-routes",
    "staticRoutes": "passed-78-routes",
    "renderedChapter": "passed-static-render-pending-browser-review",
    "internalStaticLinkValidator": "passed-623-links",
    "resourceMetadata": "passed",
    "citationMetadata": "pending-independent-citation-review",
    "independentMathReview": "pending",
    "independentEditorialReview": "pending",
    "independentAccessibilityReview": "pending"
  },
  "openIssues": [
    "The official brochure provides a title and elective-pool placement but no unit-level syllabus.",
    "Independent mathematics, citation, code, editorial, originality, accessibility, and rendered-publication reviews remain required.",
    "Only Chapter 1 is authored; the remaining nine proposed chapters remain planned."
  ],
  "recommendedNextTasks": [
    "Run repository build, rendered, link, lint, type, audit, and diff gates.",
    "Run independent FastAPI code and mathematics review on the immutable chapter commit.",
    "Inspect desktop and mobile rendering before considering publication approval.",
    "Author Chapter 2 only after Chapter 1 review findings are dispositioned."
  ]
}
