{
  "agentId": "subject-lead-ai-ml-for-robotics-reference-chapter",
  "subject": "AI and ML for Robotics",
  "task": "Create the first full-content narrative vertical slice and subject-book skeleton for a title-only elective",
  "status": "completed",
  "filesCreated": [
    "content/subjects/ai-and-ml-for-robotics/index.mdx",
    "content/subjects/ai-and-ml-for-robotics/book/00-preface.md",
    "content/subjects/ai-and-ml-for-robotics/book/01-how-to-use-this-book.md",
    "content/subjects/ai-and-ml-for-robotics/book/02-prerequisites.md",
    "content/subjects/ai-and-ml-for-robotics/book/03-learning-outcomes.md",
    "content/subjects/ai-and-ml-for-robotics/book/04-subject-roadmap.md",
    "content/subjects/ai-and-ml-for-robotics/book/05-mathematical-notation.md",
    "content/subjects/ai-and-ml-for-robotics/chapters/01-a-robot-learns-in-a-loop.mdx",
    "content/subjects/ai-and-ml-for-robotics/research-papers/README.md",
    "content/subjects/ai-and-ml-for-robotics/papers/README.md",
    "content/subjects/ai-and-ml-for-robotics/projects/README.md",
    "content/subjects/ai-and-ml-for-robotics/assignments/README.md",
    "content/subjects/ai-and-ml-for-robotics/quizzes/README.md",
    "content/subjects/ai-and-ml-for-robotics/datasets/README.md",
    "content/subjects/ai-and-ml-for-robotics/references.md",
    "content/subjects/ai-and-ml-for-robotics/references.bib",
    "content/subjects/ai-and-ml-for-robotics/glossary.md",
    "content/subjects/ai-and-ml-for-robotics/further-reading.md",
    "tasks/agent-work/electives/ai-ml-for-robotics/reference-chapter/word-count-validation.json",
    "tasks/agent-work/electives/ai-ml-for-robotics/reference-chapter/heading-validation.json",
    "tasks/agent-work/electives/ai-ml-for-robotics/reference-chapter/code-validation.json",
    "tasks/agent-work/electives/ai-ml-for-robotics/reference-chapter/source-validation.json",
    "tasks/agent-work/electives/ai-ml-for-robotics/reference-chapter/completion-report.json"
  ],
  "filesModified": [],
  "sourcesUsed": [
    "BITS Pilani WILP M.Tech. Artificial Intelligence and Machine Learning brochure, verified SHA-256 fee3ec5d142deb610e1f0a86df9267e3c9355f1dfdda4419d21f49b45207de1b",
    "Kober, Bagnell, and Peters (2013), Reinforcement Learning in Robotics: A Survey, DOI 10.1177/0278364913495721",
    "Tobin et al. (2017), Domain Randomization for Transferring Deep Neural Networks from Simulation to the Real World, DOI 10.1109/IROS.2017.8202133",
    "Thrun, Burgard, and Fox (2005), Probabilistic Robotics, MIT Press",
    "Sutton and Barto (2018), Reinforcement Learning: An Introduction, second edition, MIT Press"
  ],
  "citationsVerified": 0,
  "citationsRejected": 0,
  "wordCount": 3043,
  "testsRun": [
    "exact extraction and execution of one published Python block",
    "meaningful prose count: 3043",
    "compact heading audit: 10 H2 and no authored H1",
    "npm test: 3 of 3 rendered/static tests passed",
    "npm run validate:foundation: passed 45 subjects and 45 leads",
    "GITHUB_REPOSITORY=shivam2003-dev/mtech-ai-ml-learning-hub npm run validate:links: passed 593 links",
    "npm run lint: passed",
    "npx tsc --noEmit --incremental false: passed",
    "npm audit --omit=dev --audit-level=high: passed with 0 production vulnerabilities",
    "git diff --check: passed"
  ],
  "validationResults": {
    "officialCurriculumBoundary": "passed-title-only-and-configurable-semester-boundary",
    "topicClassification": "passed: proposed robotics concepts are labelled supplementary, prerequisite, advanced extension, or industry application",
    "meaningfulProseWords": 3043,
    "chapterFrontmatterWordCountMatches": true,
    "chapterStructure": "passed-10-H2-compact-narrative",
    "codeExecution": "passed-4-contract-checks",
    "mdxAndMathJaxBuild": "passed",
    "staticRoutes": "passed-75-pages",
    "internalLinks": "passed-593",
    "independentMathReview": "pending",
    "independentCitationReview": "pending",
    "independentEditorialReview": "pending",
    "independentRenderedAccessibilityReview": "pending"
  },
  "openIssues": [
    "The official brochure does not provide a detailed robotics syllabus; the chapter is a provisional educational interpretation.",
    "Independent mathematics, citation, editorial, originality, and rendered accessibility reviews remain required.",
    "Only the first reference chapter is authored; the remaining proposed chapters, full project contracts, assignments, quizzes, and paper notes remain pending."
  ],
  "recommendedNextTasks": [
    "Run independent review against the immutable chapter snapshot before publishing.",
    "Inspect the subject and chapter at desktop, mobile, print, and dark-mode widths.",
    "Author Chapter 2 only after the first chapter's review findings are dispositioned."
  ]
}
