{
  "agentId": "subject-lead-sem-02-deep-neural-networks",
  "subject": "Deep Neural Networks",
  "task": "Create the Semester 2 subject planning bundle without drafting full chapters",
  "status": "completed",
  "filesCreated": [
    "tasks/agent-work/semester-2/deep-neural-networks/plan.md",
    "tasks/agent-work/semester-2/deep-neural-networks/completion-report.json"
  ],
  "filesModified": [],
  "sourcesUsed": [
    "official-brochure | /Users/shivamkumar/Downloads/mtech-ai-ml.pdf | sha256 fee3ec5d142deb610e1f0a86df9267e3c9355f1dfdda4419d21f49b45207de1b | physical pages 12 and 14 | verified local source",
    "R01 | https://www.deeplearningbook.org/ | verified official author site",
    "R02 | https://d2l.ai/ | verified official project site",
    "R03 | https://docs.pytorch.org/tutorials/ | verified official documentation",
    "R04 | https://www.tensorflow.org/guide/keras | verified official documentation",
    "R05 | https://cs231n.stanford.edu/ | verified institutional course",
    "R06 | https://web.stanford.edu/class/cs224n/ | verified institutional course",
    "R07 | https://doi.org/10.1037/h0042519 | verified Crossref and resolver",
    "R08 | https://doi.org/10.1038/323533a0 | verified Crossref and resolver",
    "R09 | https://doi.org/10.1016/0893-6080(89)90020-8 | verified Crossref and resolver",
    "R10 | https://doi.org/10.1109/5.726791 | verified Crossref and resolver",
    "R11 | https://doi.org/10.1162/neco.1997.9.8.1735 | verified Crossref and resolver",
    "R12 | https://papers.neurips.cc/paper/4824-imagenet-classification-with-deep-convolutional-neural-networks | verified official proceedings",
    "R13 | https://jmlr.org/papers/v15/srivastava14a.html | verified official journal",
    "R14 | https://proceedings.mlr.press/v37/ioffe15.html | verified official proceedings and arXiv",
    "R15 | https://arxiv.org/abs/1412.6980 | verified arXiv and venue",
    "R16 | https://doi.org/10.1109/CVPR.2016.90 | verified Crossref and resolver",
    "R17 | https://papers.neurips.cc/paper/5346-sequence-to-sequence-learning-with-neural-networks | verified official proceedings and arXiv",
    "R18 | https://papers.neurips.cc/paper/7181-attention-is-all-you-need | verified official proceedings and arXiv",
    "R19 | https://openreview.net/forum?id=YicbFdNTTy | verified accepted OpenReview and arXiv",
    "R20 | https://openreview.net/forum?id=nZeVKeeFYf9 | verified accepted OpenReview and arXiv",
    "R21 | https://arxiv.org/abs/2001.08361 | verified arXiv",
    "R22 | https://doi.org/10.52202/068431-2176 | official NeurIPS record and arXiv 2203.15556 verified",
    "R23 | https://doi.org/10.1038/nature14539 | verified Crossref and resolver",
    "R24 | https://doi.org/10.1109/TKDE.2009.191 | verified Crossref and resolver",
    "R25 | https://doi.org/10.1137/16M1080173 | verified Crossref and resolver",
    "R26 | https://arxiv.org/abs/1312.6199 | verified arXiv and venue",
    "R27 | https://doi.org/10.1145/3287560.3287596 | verified Crossref and resolver",
    "R28 | https://proceedings.mlr.press/v70/guo17a.html | verified official PMLR",
    "R29 | https://arxiv.org/abs/2202.08587 | verified arXiv and institutional author record"
  ],
  "citationsVerified": 29,
  "citationsRejected": 2,
  "wordCount": 6506,
  "testsRun": [
    "verified brochure SHA-256 and page locators",
    "transcribed and mapped all 12 official topic phrases",
    "checked chapter count is within 8-16",
    "summed 12 chapter-hour rows to 184",
    "validated additive total workload 8 + 82 + 50 + 30 + 22 + 32 + 12 = 236",
    "checked 29 canonical resource URLs with redirects and bounded concurrency",
    "queried DOI metadata through Crossref",
    "queried arXiv identifiers in bounded batches",
    "verified accepted OpenReview records for ViT and LoRA",
    "verified the official NeurIPS R22 record, DOI 10.52202/068431-2176, and related arXiv identity",
    "verified modern Chapter 2 and Chapter 4 paper destinations through official PMLR and arXiv records",
    "inspected all six projects for every required contract field",
    "validated completion-report JSON against packages/content-schema/schemas/agent-report.schema.json with AJV draft 2020",
    "confirmed no full chapter was created"
  ],
  "validationResults": {
    "officialCourseIdentity": "passed",
    "officialTopicTranscription": "passed-exact",
    "officialTopicCoverage": "passed-12-of-12",
    "additionClassification": "passed",
    "chapterCount": "passed-12",
    "learningOutcomes": "passed-provisional",
    "prerequisiteMap": "passed-provisional",
    "knowledgeGraph": "passed-provisional",
    "crossSubjectBoundaries": "passed-provisional-ownership-matrix-required-before-prose",
    "researchQueries": "passed-15",
    "academicResources": "passed-29",
    "paperReadingPath": "passed-23",
    "paperCategoryMix": "passed-5-foundational-6-established-7-modern-3-survey-2-applied",
    "projectLevels": "passed-2-beginner-2-intermediate-1-advanced-1-research",
    "projectContractFields": "passed-all-six",
    "estimatedHours": "passed-236",
    "citationMetadata": "passed-with-2-rejections-documented",
    "agentReportSchema": "passed-draft-2020-no-additional-properties",
    "citationRejections": [
      "DOI 10.1145/3065386 was rejected as the original 2012 NeurIPS AlexNet citation because Crossref identifies the 2017 Communications of the ACM republication; the official 2012 NeurIPS record is used.",
      "DOI 10.48550/arXiv.1207.0580 was rejected as the identifier for the 2014 JMLR Dropout paper because it belongs to a related 2012 preprint with a different title and author record; the official JMLR article is used."
    ],
    "fullChapterDraft": "not-created-as-required"
  },
  "openIssues": [
    "External project datasets need immutable snapshots, checksums, and a final licence record before implementation.",
    "Cross-subject ownership must be frozen before DNN prose is generated.",
    "Claim-level paper verification remains a chapter-authoring gate.",
    "Current documentation and link availability must be rechecked at publication."
  ],
  "recommendedNextTasks": [
    "Integrate provisional subject metadata and the outline.",
    "Create and approve a cross-subject concept ownership matrix.",
    "Create Chapter 1 and Chapter 4 task specifications.",
    "Finalize project dataset snapshots and licences.",
    "Run independent mathematics, code, citation, accessibility, and editorial reviews before any chapter approval."
  ]
}
